{
 "app": "drawflow",
 "format": 2,
 "savedAt": 1789915137540,
 "project": {
  "name": "Business presentation",
  "width": 1920,
  "height": 1080,
  "fps": 30,
  "background": "#ffffff",
  "paper": "plain",
  "duration": 39.640000000000015,
  "hand": "marker",
  "cameraEasing": "easeOut",
  "cameraFill": 0.5,
  "zoomAtEnd": false,
  "endHold": 1.5,
  "scenes": [
   {
    "id": "9c064845-1bf3-40de-9b3a-0971fc6211fa",
    "name": "Agenda",
    "transition": "cut",
    "transitionDuration": 0.6
   },
   {
    "id": "aaadfd68-316a-418b-8439-6f95a8a2193c",
    "name": "Numbers",
    "transition": "wipe",
    "transitionDuration": 0.6,
    "clearBefore": true
   },
   {
    "id": "23266c61-80cc-4459-96c8-a09913edf59a",
    "name": "Plan",
    "transition": "fade",
    "transitionDuration": 0.6,
    "clearBefore": true
   }
  ],
  "markers": []
 },
 "elements": [
  {
   "id": "5cf14646-2dc4-4e43-8ef2-ad69144db556",
   "label": "Q3 review",
   "rotation": 0,
   "startTime": 0,
   "transitionIn": 0.5,
   "pauseAfter": 0.6,
   "slideFrom": "left",
   "zIndex": 0,
   "camera": "scene",
   "cameraZoom": 1,
   "sceneId": "9c064845-1bf3-40de-9b3a-0971fc6211fa",
   "style": "draw",
   "fillAfterDraw": true,
   "fillColor": "#1a1a1a",
   "strokeColor": "#1a1a1a",
   "strokeWidth": 5.92,
   "scale": 1,
   "kind": "text",
   "paths": [
    "M66.58 165.84L49.36 143.14L62.89 143.14L74.24 158.05L77.11 162.01L94.06 184.57L80.53 184.57L69.45 169.67L66.58 165.84ZM53.59 176.37L53.59 176.37Q40.54 176.37 30.32 170.04Q20.10 163.72 14.22 152.00Q8.34 140.27 8.34 124.14L8.34 124.14Q8.34 107.94 14.22 96.22Q20.10 84.49 30.32 78.13Q40.54 71.78 53.59 71.78L53.59 71.78Q66.65 71.78 76.84 78.13Q87.02 84.49 92.87 96.22Q98.71 107.94 98.71 124.14L98.71 124.14Q98.71 140.27 92.87 152.00Q87.02 163.72 76.84 170.04Q66.65 176.37 53.59 176.37ZM53.59 164.34L53.59 164.34Q62.69 164.34 70.03 159.72Q77.38 155.11 81.72 146.12Q86.06 137.13 86.06 124.14L86.06 124.14Q86.06 111.02 81.72 102.03Q77.38 93.04 70.03 88.42Q62.69 83.81 53.59 83.81L53.59 83.81Q44.43 83.81 37.05 88.46Q29.67 93.11 25.33 102.09Q20.99 111.08 20.99 124.14L20.99 124.14Q20.99 137.13 25.33 146.08Q29.67 155.04 37.05 159.69Q44.43 164.34 53.59 164.34Z",
    "M150.46 176.37L150.46 176.37Q140.48 176.37 132.75 172.95Q125.03 169.53 120.48 163.45Q115.94 157.36 115.60 149.30L115.60 149.30L128.72 149.30Q129.13 154.15 132.04 157.67Q134.94 161.19 139.69 163.07Q144.44 164.95 150.25 164.95L150.25 164.95Q156.68 164.95 161.64 162.73Q166.59 160.51 169.46 156.47Q172.33 152.44 172.33 147.18L172.33 147.18Q172.33 141.64 169.57 137.44Q166.80 133.23 161.53 130.84Q156.27 128.45 148.68 128.45L148.68 128.45L140.41 128.45L140.41 117.17L148.68 117.17Q154.63 117.17 159.17 115.01Q163.72 112.86 166.25 108.96Q168.78 105.07 168.78 99.80L168.78 99.80Q168.78 94.75 166.56 90.99Q164.34 87.23 160.23 85.14Q156.13 83.06 150.60 83.06L150.60 83.06Q145.40 83.06 140.85 84.94Q136.31 86.82 133.40 90.30Q130.50 93.79 130.29 98.78L130.29 98.78L117.78 98.78Q118.06 90.78 122.57 84.70Q127.08 78.61 134.50 75.20Q141.91 71.78 150.87 71.78L150.87 71.78Q160.37 71.78 167.24 75.61Q174.11 79.43 177.80 85.65Q181.49 91.88 181.49 99.12L181.49 99.12Q181.49 107.73 176.95 113.75Q172.40 119.77 164.61 122.09L164.61 122.09L164.61 122.91Q171.10 123.94 175.72 127.29Q180.33 130.63 182.76 135.76Q185.19 140.89 185.19 147.31L185.19 147.31Q185.19 155.65 180.67 162.22Q176.16 168.78 168.30 172.57Q160.44 176.37 150.46 176.37Z",
    "M256.01 175L243.70 175L243.70 98.57L255.60 98.57L255.60 110.33L256.42 110.33Q258.54 104.52 263.97 101.00Q269.40 97.48 276.24 97.48L276.24 97.48Q277.61 97.48 279.49 97.55Q281.37 97.62 282.46 97.69L282.46 97.69L282.46 110.06Q281.91 109.92 279.73 109.65Q277.54 109.38 275.08 109.38L275.08 109.38Q269.61 109.38 265.27 111.67Q260.93 113.96 258.47 117.95Q256.01 121.95 256.01 127.15L256.01 127.15L256.01 175Z",
    "M328.54 176.64L328.54 176.64Q317.46 176.64 309.43 171.72Q301.40 166.80 297.06 157.98Q292.71 149.16 292.71 137.40L292.71 137.40Q292.71 125.64 296.95 116.69Q301.19 107.73 308.95 102.68Q316.71 97.62 327.10 97.62L327.10 97.62Q333.18 97.62 339.10 99.63Q345.01 101.65 349.83 106.13Q354.65 110.61 357.52 117.92Q360.39 125.23 360.39 135.83L360.39 135.83L360.39 140.96L301.05 140.96L301.05 130.57L353.76 130.57L348.02 134.39Q348.02 126.88 345.66 121.03Q343.30 115.19 338.65 111.87Q334.00 108.55 327.10 108.55L327.10 108.55Q320.20 108.55 315.27 111.94Q310.35 115.32 307.75 120.76Q305.16 126.19 305.16 132.41L305.16 132.41L305.16 139.32Q305.16 147.79 308.10 153.71Q311.04 159.62 316.33 162.66Q321.63 165.70 328.60 165.70L328.60 165.70Q333.12 165.70 336.81 164.40Q340.50 163.11 343.16 160.47Q345.83 157.84 347.27 153.95L347.27 153.95L359.16 157.23Q357.38 162.97 353.14 167.34Q348.91 171.72 342.65 174.18Q336.40 176.64 328.54 176.64Z",
    "M413.03 175L400.11 175L370.92 98.57L384.38 98.57L400.65 143.90Q403.25 150.94 405.06 157.94Q406.88 164.95 408.86 171.51L408.86 171.51L404.35 171.51Q406.33 164.95 408.14 157.94Q409.95 150.94 412.48 143.90L412.48 143.90L428.75 98.57L442.22 98.57L413.03 175Z",
    "M469.01 175L456.71 175L456.71 98.57L469.01 98.57L469.01 175ZM462.93 86.06L462.93 86.06Q459.44 86.06 456.91 83.67Q454.38 81.28 454.38 77.93L454.38 77.93Q454.38 74.51 456.91 72.15Q459.44 69.79 462.93 69.79L462.93 69.79Q466.48 69.79 469.01 72.15Q471.54 74.51 471.54 77.93L471.54 77.93Q471.54 81.28 469.01 83.67Q466.48 86.06 462.93 86.06Z",
    "M522.74 176.64L522.74 176.64Q511.67 176.64 503.64 171.72Q495.61 166.80 491.26 157.98Q486.92 149.16 486.92 137.40L486.92 137.40Q486.92 125.64 491.16 116.69Q495.40 107.73 503.16 102.68Q510.92 97.62 521.31 97.62L521.31 97.62Q527.39 97.62 533.31 99.63Q539.22 101.65 544.04 106.13Q548.86 110.61 551.73 117.92Q554.60 125.23 554.60 135.83L554.60 135.83L554.60 140.96L495.26 140.96L495.26 130.57L547.97 130.57L542.23 134.39Q542.23 126.88 539.87 121.03Q537.51 115.19 532.86 111.87Q528.21 108.55 521.31 108.55L521.31 108.55Q514.40 108.55 509.48 111.94Q504.56 115.32 501.96 120.76Q499.37 126.19 499.37 132.41L499.37 132.41L499.37 139.32Q499.37 147.79 502.30 153.71Q505.24 159.62 510.54 162.66Q515.84 165.70 522.81 165.70L522.81 165.70Q527.32 165.70 531.02 164.40Q534.71 163.11 537.37 160.47Q540.04 157.84 541.47 153.95L541.47 153.95L553.37 157.23Q551.59 162.97 547.35 167.34Q543.12 171.72 536.86 174.18Q530.61 176.64 522.74 176.64Z",
    "M601.63 175L589.39 175L566.22 98.57L579.28 98.57L588.57 131.93Q590.49 138.77 592.68 147.42Q594.86 156.06 596.98 167.00L596.98 167.00L594.86 167.00Q596.91 156.54 599.03 147.86Q601.15 139.18 603.13 131.93L603.13 131.93L612.29 98.57L625.42 98.57L634.44 131.93Q636.36 138.97 638.44 147.62Q640.53 156.27 642.58 167.00L642.58 167.00L640.39 167.00Q642.58 156.41 644.73 147.76Q646.88 139.11 648.87 131.93L648.87 131.93L658.16 98.57L671.22 98.57L648.05 175L635.81 175L625.90 140.41Q624.39 135.15 622.96 129.68Q621.52 124.21 620.16 118.47Q618.79 112.72 617.35 106.78L617.35 106.78L620.09 106.78Q618.72 112.66 617.32 118.43Q615.92 124.21 614.48 129.75Q613.05 135.28 611.54 140.41L611.54 140.41L601.63 175Z"
   ],
   "text": "Q3 review",
   "fontFamily": "inter",
   "fontSize": 140,
   "fontWeight": "bold",
   "x": 291.6599998474121,
   "y": 112.81999588012695,
   "drawDuration": 1.2,
   "emphasis": null
  },
  {
   "id": "fd857e0b-5167-4464-808b-f198a5f59718",
   "label": "1. Where we are",
   "rotation": 0,
   "startTime": 2.3,
   "transitionIn": 0.5,
   "pauseAfter": 0.6,
   "slideFrom": "left",
   "zIndex": 1,
   "camera": "scene",
   "cameraZoom": 1,
   "sceneId": "9c064845-1bf3-40de-9b3a-0971fc6211fa",
   "style": "draw",
   "fillAfterDraw": true,
   "fillColor": "#1a1a1a",
   "strokeColor": "#1a1a1a",
   "strokeWidth": 2,
   "scale": 1,
   "kind": "text",
   "paths": [
    "M16.41 41.80L25.51 41.80L25.51 100L18.20 100L18.20 48.67L17.81 48.67L3.75 59.10L3.75 51.13L16.41 41.80Z",
    "M44.06 100.51L44.06 100.51Q41.88 100.51 40.33 98.96Q38.79 97.42 38.79 95.23L38.79 95.23Q38.79 93.05 40.33 91.50Q41.88 89.96 44.06 89.96L44.06 89.96Q46.25 89.96 47.79 91.50Q49.34 93.05 49.34 95.23L49.34 95.23Q49.34 97.42 47.79 98.96Q46.25 100.51 44.06 100.51Z",
    "M104.65 100L95.98 100L80.12 41.80L87.70 41.80L96.91 77.50Q97.66 80.35 98.32 83.30Q98.98 86.25 99.61 89.28Q100.23 92.30 100.78 95.51L100.78 95.51L99.88 95.51Q100.47 92.30 101.09 89.28Q101.72 86.25 102.42 83.30Q103.13 80.35 103.87 77.50L103.87 77.50L113.28 41.80L121.72 41.80L131.05 77.50Q131.84 80.35 132.52 83.30Q133.20 86.25 133.87 89.28Q134.53 92.30 135.12 95.51L135.12 95.51L134.10 95.51Q134.69 92.30 135.31 89.28Q135.94 86.25 136.64 83.30Q137.34 80.35 138.05 77.50L138.05 77.50L147.23 41.80L154.88 41.80L138.95 100L130.31 100L120.31 63.13Q119.34 59.53 118.44 55.29Q117.54 51.05 116.68 45.51L116.68 45.51L118.24 45.51Q117.38 50.74 116.56 54.86Q115.74 58.98 114.61 63.13L114.61 63.13L104.65 100Z",
    "M170.12 73.83L170.12 73.83L170.12 100L163.09 100L163.09 41.80L170.12 41.80L170.12 66.91L168.91 66.91Q170.90 60.86 174.59 58.32Q178.28 55.78 183.24 55.78L183.24 55.78Q187.66 55.78 191.00 57.60Q194.34 59.41 196.19 63.07Q198.05 66.72 198.05 72.27L198.05 72.27L198.05 100L190.98 100L190.98 72.85Q190.98 67.81 188.34 64.96Q185.70 62.11 181.13 62.11L181.13 62.11Q178.01 62.11 175.51 63.48Q173.01 64.84 171.56 67.46Q170.12 70.08 170.12 73.83Z",